<Empresa_Detalhe xmlns:xsi="http://www.w3.org/2001/XMLSchema-instance"
         xsi:noNamespaceSchemaLocation="Empresa_Detalhe.xsd">
  <Codigo>123456</Codigo>
  <Razao_Social>Empresa de Teste</Razao_Social>
  <Cpf_Cnpj>50.387.655/0002-23</Cpf_Cnpj>
  <Inscricao_Estadual>12121</Inscricao_Estadual>
  <Endereco>Rua de Teste, 345 - 2ª Andar</Endereco>
  <Bairro>Nova Cidade</Bairro>
  <Cidade>Jaboticabal</Cidade>
  <UF>SP</UF>
  <Cep>15990450</Cep>
  <Data_Abertura>1980-03-23T10:20:15</Data_Abertura>
  <Data_Encerramento>1980-03-23T10:20:15</Data_Encerramento>
  <Atividade>Mecânico</Atividade>
  <Situacao>Ativa</Situacao>
  <Email>email@gti.com</Email>
  <Telefone>(16) 3333-2222</Telefone>
  <RegimeISS>Variavel</RegimeISS>
  <Taxa_Licenca>Sim</Taxa_Licenca>
  <Vigilancia_Sanitaria>Não</Vigilancia_Sanitaria>
  <Cnae>12345-6/34</Cnae>
  <Mei>Sim</Mei>
  <Area>1234,56 m²</Area>
  <Proprietario>Eduardo Schwartz</Proprietario>
</Empresa_Detalhe>